title,author,rating,rating_count,description,isbn,image,url_from_jsonld,book_url,pages,published_year,language,genres
"The Hunger Games (The Hunger Games, #1)",Suzanne Collins,4.35,9943135,,9780439023481,https://m.media-amazon.com/images/S/compressed.photo.goodreads.com/books/1586722975i/2767052.jpg,,https://www.goodreads.com/book/show/2767052-the-hunger-games,374.0,,,"Young Adult, Dystopia, Fiction, Fantasy, Science Fiction"
Pride and Prejudice,Jane Austen,4.3,4821169,,9781441341709,https://m.media-amazon.com/images/S/compressed.photo.goodreads.com/books/1320399351i/1885.jpg,,https://www.goodreads.com/book/show/1885.Pride_and_Prejudice,279.0,,,"Classics, Romance, Fiction, Historical Fiction, Historical"
To Kill a Mockingbird,Harper Lee,4.26,6905680,,9780060935467,https://m.media-amazon.com/images/S/compressed.photo.goodreads.com/books/1553383690i/2657.jpg,,https://www.goodreads.com/book/show/2657.To_Kill_a_Mockingbird,323.0,,,"Classics, Fiction, Historical Fiction, School, Literature"
"Harry Potter and the Order of the Phoenix (Harry Potter, #5)",J.K. Rowling,4.5,3805184,,9780439358064,https://m.media-amazon.com/images/S/compressed.photo.goodreads.com/books/1627045351i/58613451.jpg,,https://www.goodreads.com/book/show/58613451-harry-potter-and-the-order-of-the-phoenix,896.0,,,"Fantasy, Fiction, Young Adult, Harry Potter, Magic"
The Book Thief,Markus Zusak,4.39,2887607,,,https://m.media-amazon.com/images/S/compressed.photo.goodreads.com/books/1522157426i/19063.jpg,,https://www.goodreads.com/book/show/19063.The_Book_Thief,592.0,,,"Historical Fiction, Fiction, Young Adult, Classics, Historical"
"Twilight (The Twilight Saga, #1)",Stephenie Meyer,3.67,7330984,,9780316015844,https://m.media-amazon.com/images/S/compressed.photo.goodreads.com/books/1700522826i/41865.jpg,,https://www.goodreads.com/book/show/41865.Twilight,498.0,,,"Fantasy, Young Adult, Romance, Fiction, Vampires"
Animal Farm,George Orwell,4.02,4572881,,9780451526342,https://m.media-amazon.com/images/S/compressed.photo.goodreads.com/books/1325861570i/170448.jpg,,https://www.goodreads.com/book/show/170448.Animal_Farm,141.0,,,"Classics, Fiction, Dystopia, Fantasy, School"
J.R.R. Tolkien 4-Book Boxed Set: The Hobbit and The Lord of the Rings,J.R.R. Tolkien,4.62,144569,,9780345538376,https://m.media-amazon.com/images/S/compressed.photo.goodreads.com/books/1656625315i/30.jpg,,https://www.goodreads.com/book/show/30.J_R_R_Tolkien_4_Book_Boxed_Set,1728.0,,,"Fantasy, Fiction, Classics, Adventure, Science Fiction Fantasy"
"The Chronicles of Narnia (The Chronicles of Narnia, #1-7)",C.S. Lewis,4.28,709126,,9780066238500,https://m.media-amazon.com/images/S/compressed.photo.goodreads.com/books/1661032875i/11127.jpg,,https://www.goodreads.com/book/show/11127.The_Chronicles_of_Narnia,767.0,,,"Fantasy, Classics, Fiction, Young Adult, Childrens"
The Fault in Our Stars,John Green,4.12,5738126,,,https://m.media-amazon.com/images/S/compressed.photo.goodreads.com/books/1660273739i/11870085.jpg,,https://www.goodreads.com/book/show/11870085-the-fault-in-our-stars,313.0,,,"Young Adult, Romance, Fiction, Contemporary, Realistic Fiction"
The Picture of Dorian Gray,Oscar Wilde,4.13,1888735,,,https://m.media-amazon.com/images/S/compressed.photo.goodreads.com/books/1546103428i/5297.jpg,,https://www.goodreads.com/book/show/5297.The_Picture_of_Dorian_Gray,272.0,,,"Classics, Fiction, Horror, Gothic, Fantasy"
"The Lightning Thief (Percy Jackson and the Olympians, #1)",Rick Riordan,4.31,3448544,,9780786838653,https://m.media-amazon.com/images/S/compressed.photo.goodreads.com/books/1400602609i/28187.jpg,,https://www.goodreads.com/book/show/28187.The_Lightning_Thief,377.0,,,"Fantasy, Young Adult, Mythology, Fiction, Middle Grade"
Wuthering Heights,Emily Brontë,3.9,2075739,,,https://m.media-amazon.com/images/S/compressed.photo.goodreads.com/books/1388212715i/6185.jpg,,https://www.goodreads.com/book/show/6185.Wuthering_Heights,464.0,,,"Classics, Fiction, Romance, Gothic, Historical Fiction"
The Giving Tree,Shel Silverstein,4.39,1238108,,9780060256654,https://m.media-amazon.com/images/S/compressed.photo.goodreads.com/books/1769901237i/370493.jpg,,https://www.goodreads.com/book/show/370493.The_Giving_Tree,64.0,,,"Childrens, Classics, Fiction, Picture Books, Poetry"
"Harry Potter and the Order of the Phoenix (Harry Potter, #5)",J.K. Rowling,4.5,3805184,,9780439686525,https://m.media-amazon.com/images/S/compressed.photo.goodreads.com/books/1546910265i/2.jpg,,https://www.goodreads.com/book/show/2.Harry_Potter_and_the_Order_of_the_Phoenix,870.0,,,"Fantasy, Fiction, Young Adult, Harry Potter, Magic"
The Perks of Being a Wallflower,Stephen Chbosky,4.24,2006843,,,https://m.media-amazon.com/images/S/compressed.photo.goodreads.com/books/1650033115i/22628.jpg,,https://www.goodreads.com/book/show/22628.The_Perks_of_Being_a_Wallflower,213.0,,,"Young Adult, Fiction, Contemporary, Classics, Coming Of Age"
Gone with the Wind,Margaret Mitchell,4.31,1257974,,9780446365383,https://m.media-amazon.com/images/S/compressed.photo.goodreads.com/books/1551144577i/18405.jpg,,https://www.goodreads.com/book/show/18405.Gone_with_the_Wind,1037.0,,,"Classics, Historical Fiction, Fiction, Romance, Historical"
The Little Prince,Antoine de Saint-Exupéry,4.33,2488745,,9780152023980,https://m.media-amazon.com/images/S/compressed.photo.goodreads.com/books/1367545443i/157993.jpg,,https://www.goodreads.com/book/show/157993.The_Little_Prince,96.0,,,"Classics, Fiction, Fantasy, Childrens, France"
Jane Eyre,Charlotte Brontë,4.16,2330437,,9780142437209,https://m.media-amazon.com/images/S/compressed.photo.goodreads.com/books/1557343311i/10210.jpg,,https://www.goodreads.com/book/show/10210.Jane_Eyre,532.0,,,"Classics, Fiction, Romance, Gothic, Historical Fiction"
The Great Gatsby,F. Scott Fitzgerald,3.93,5935549,,9780743273565,https://m.media-amazon.com/images/S/compressed.photo.goodreads.com/books/1738790966i/4671.jpg,,https://www.goodreads.com/book/show/4671.The_Great_Gatsby,180.0,,,"Classics, Fiction, School, Historical Fiction, Romance"
Crime and Punishment,Fyodor Dostoevsky,4.29,1086646,,,https://m.media-amazon.com/images/S/compressed.photo.goodreads.com/books/1382846449i/7144.jpg,,https://www.goodreads.com/book/show/7144.Crime_and_Punishment,671.0,,,"Classics, Fiction, Russia, Russian Literature, Literature"
"The Da Vinci Code (Robert Langdon, #2)",Dan    Brown,3.94,2528748,,,https://m.media-amazon.com/images/S/compressed.photo.goodreads.com/books/1720313229i/968.jpg,,https://www.goodreads.com/book/show/968.The_Da_Vinci_Code,489.0,,,"Fiction, Mystery, Thriller, Mystery Thriller, Historical Fiction"
Alice’s Adventures in Wonderland / Through the Looking-Glass,Lewis Carroll,4.06,610458,,,https://m.media-amazon.com/images/S/compressed.photo.goodreads.com/books/1630487234i/24213.jpg,,https://www.goodreads.com/book/show/24213.Alice_s_Adventures_in_Wonderland_Through_the_Looking_Glass,239.0,,,"Classics, Fantasy, Fiction, Childrens, Young Adult"
"Divergent (Divergent, #1)",Veronica Roth,4.13,4389498,,9780062024039,https://m.media-amazon.com/images/S/compressed.photo.goodreads.com/books/1618526890i/13335037.jpg,,https://www.goodreads.com/book/show/13335037-divergent,487.0,,,"Young Adult, Dystopia, Fantasy, Fiction, Science Fiction"
Les Misérables,Victor Hugo,4.21,845250,,9780451525260,https://m.media-amazon.com/images/S/compressed.photo.goodreads.com/books/1411852091i/24280.jpg,,https://www.goodreads.com/book/show/24280.Les_Mis_rables,1463.0,,,"Classics, Fiction, Historical Fiction, Literature, France"
Memoirs of a Geisha,Arthur Golden,4.16,2113180,,9781400096893,https://m.media-amazon.com/images/S/compressed.photo.goodreads.com/books/1409595968i/929.jpg,,https://www.goodreads.com/book/show/929.Memoirs_of_a_Geisha,503.0,,,"Fiction, Historical Fiction, Romance, Classics, Historical"
The Alchemist,Paulo Coelho,3.92,3584224,,9780061122415,https://m.media-amazon.com/images/S/compressed.photo.goodreads.com/books/1483412266i/865.jpg,,https://www.goodreads.com/book/show/865.The_Alchemist,197.0,,,"Fiction, Classics, Fantasy, Philosophy, Self Help"
"Anne of Green Gables (Anne of Green Gables, #1)",L.M. Montgomery,4.33,1116658,,9780451528827,https://m.media-amazon.com/images/S/compressed.photo.goodreads.com/books/1615094578i/8127.jpg,,https://www.goodreads.com/book/show/8127.Anne_of_Green_Gables,320.0,,,"Classics, Fiction, Young Adult, Historical Fiction, Childrens"
Lord of the Flies,William Golding,3.7,3209108,,9780140283334,https://m.media-amazon.com/images/S/compressed.photo.goodreads.com/books/1327869409i/7624.jpg,,https://www.goodreads.com/book/show/7624.Lord_of_the_Flies,182.0,,,"Classics, Fiction, Young Adult, School, Dystopia"
Romeo and Juliet,William Shakespeare,3.74,2827910,,9780743477116,https://m.media-amazon.com/images/S/compressed.photo.goodreads.com/books/1629680008i/18135.jpg,,https://www.goodreads.com/book/show/18135.Romeo_and_Juliet,281.0,,,"Classics, Plays, Fiction, Romance, School"
Brave New World,Aldous Huxley,3.99,2083398,,9780060929879,https://m.media-amazon.com/images/S/compressed.photo.goodreads.com/books/1575509280i/5129.jpg,,https://www.goodreads.com/book/show/5129.Brave_New_World,288.0,,,"Classics, Fiction, Science Fiction, Dystopia, Literature"
"The Hitchhiker’s Guide to the Galaxy (Hitchhiker&apos;s Guide to the Galaxy, #1)",Douglas Adams,4.22,2020690,,,https://m.media-amazon.com/images/S/compressed.photo.goodreads.com/books/1531891848i/11.jpg,,https://www.goodreads.com/book/show/11.The_Hitchhiker_s_Guide_to_the_Galaxy,216.0,,,"Science Fiction, Fiction, Classics, Humor, Fantasy"
"City of Bones (The Mortal Instruments, #1)",Cassandra Clare,4.07,2172493,,9781416914280,https://m.media-amazon.com/images/S/compressed.photo.goodreads.com/books/1432730315i/256683.jpg,,https://www.goodreads.com/book/show/256683.City_of_Bones,485.0,,,"Fantasy, Young Adult, Romance, Paranormal, Urban Fantasy"
The Help,Kathryn Stockett,4.47,3027931,,9780399155345,https://m.media-amazon.com/images/S/compressed.photo.goodreads.com/books/1622355533i/4667024.jpg,,https://www.goodreads.com/book/show/4667024-the-help,451.0,,,"Fiction, Historical Fiction, Book Club, Historical, Classics"
Dracula,Bram Stoker,4.02,1481682,,9780393970128,https://m.media-amazon.com/images/S/compressed.photo.goodreads.com/books/1387151694i/17245.jpg,,https://www.goodreads.com/book/show/17245.Dracula,488.0,,,"Classics, Horror, Fiction, Fantasy, Gothic"
Fahrenheit 451,Ray Bradbury,3.97,2850088,,,https://m.media-amazon.com/images/S/compressed.photo.goodreads.com/books/1383718290i/13079982.jpg,,https://www.goodreads.com/book/show/13079982-fahrenheit-451,249.0,,,"Classics, Fiction, Science Fiction, Dystopia, School"
Charlotte’s Web,E.B. White,4.21,2051294,,9780064410939,https://m.media-amazon.com/images/S/compressed.photo.goodreads.com/books/1628267712i/24178.jpg,,https://www.goodreads.com/book/show/24178.Charlotte_s_Web,184.0,,,"Classics, Fiction, Childrens, Fantasy, Young Adult"
1984,George Orwell,4.2,5487289,,,https://m.media-amazon.com/images/S/compressed.photo.goodreads.com/books/1532714506i/40961427.jpg,,https://www.goodreads.com/book/show/40961427-1984,298.0,,,"Classics, Fiction, Science Fiction, Dystopia, Literature"
Of Mice and Men,John Steinbeck,3.9,2845196,,9780142000670,https://m.media-amazon.com/images/S/compressed.photo.goodreads.com/books/1511302904i/890.jpg,,https://www.goodreads.com/book/show/890.Of_Mice_and_Men,107.0,,,"Classics, Fiction, School, Historical Fiction, Literature"
"Ender’s Game (Ender&apos;s Saga, #1)",Orson Scott Card,4.31,1475997,,9780812550702,https://m.media-amazon.com/images/S/compressed.photo.goodreads.com/books/1408303130i/375802.jpg,,https://www.goodreads.com/book/show/375802.Ender_s_Game,324.0,,,"Science Fiction, Fiction, Young Adult, Fantasy, Classics"
The Catcher in the Rye,J.D. Salinger,3.8,3903212,,9780316769174,https://m.media-amazon.com/images/S/compressed.photo.goodreads.com/books/1398034300i/5107.jpg,,https://www.goodreads.com/book/show/5107.The_Catcher_in_the_Rye,277.0,,,"Classics, Fiction, Young Adult, Literature, School"
"Little Women (Little Women, #1)",Louisa May Alcott,4.17,2468085,,,https://m.media-amazon.com/images/S/compressed.photo.goodreads.com/books/1562690475i/1934.jpg,,https://www.goodreads.com/book/show/1934.Little_Women,449.0,,,"Classics, Fiction, Historical Fiction, Young Adult, Romance"
One Hundred Years of Solitude,Gabriel García Márquez,4.12,1108438,,,https://m.media-amazon.com/images/S/compressed.photo.goodreads.com/books/1327881361i/320.jpg,,https://www.goodreads.com/book/show/320.One_Hundred_Years_of_Solitude,417.0,,,"Classics, Fiction, Magical Realism, Fantasy, Literature"
A Thousand Splendid Suns,Khaled Hosseini,4.46,1741724,,9781594489501,https://m.media-amazon.com/images/S/compressed.photo.goodreads.com/books/1655336738i/128029.jpg,,https://www.goodreads.com/book/show/128029.A_Thousand_Splendid_Suns,372.0,,,"Fiction, Historical Fiction, Book Club, Contemporary, Historical"
The Outsiders,S.E. Hinton,4.15,1610401,,9780670532575,https://m.media-amazon.com/images/S/compressed.photo.goodreads.com/books/1442129426i/231804.jpg,,https://www.goodreads.com/book/show/231804.The_Outsiders,208.0,,,"Classics, Young Adult, Fiction, School, Read For School"
The Secret Garden,Frances Hodgson Burnett,4.17,1299620,,9780517189603,https://m.media-amazon.com/images/S/compressed.photo.goodreads.com/books/1327873635i/2998.jpg,,https://www.goodreads.com/book/show/2998.The_Secret_Garden,331.0,,,"Classics, Fiction, Childrens, Young Adult, Historical Fiction"
The Princess Bride,William Goldman,4.27,949200,,9780345418265,https://m.media-amazon.com/images/S/compressed.photo.goodreads.com/books/1327903636i/21787.jpg,,https://www.goodreads.com/book/show/21787.The_Princess_Bride,429.0,,,"Fantasy, Classics, Fiction, Romance, Humor"
"A Game of Thrones (A Song of Ice and Fire, #1)",George R.R. Martin,4.45,2740618,,9780553588484,https://m.media-amazon.com/images/S/compressed.photo.goodreads.com/books/1562726234i/13496.jpg,,https://www.goodreads.com/book/show/13496.A_Game_of_Thrones,835.0,,,"Fantasy, Fiction, Epic Fantasy, High Fantasy, Adult"
The Time Traveler&apos;s Wife,Audrey Niffenegger,4,1859366,,9781939126016,https://m.media-amazon.com/images/S/compressed.photo.goodreads.com/books/1733519901i/18619684.jpg,,https://www.goodreads.com/book/show/18619684-the-time-traveler-s-wife,537.0,,,"Fiction, Romance, Fantasy, Time Travel, Science Fiction"
"Harry Potter and the Deathly Hallows (Harry Potter, #7)",J.K. Rowling,4.62,4119236,,,https://m.media-amazon.com/images/S/compressed.photo.goodreads.com/books/1663805647i/136251.jpg,,https://www.goodreads.com/book/show/136251.Harry_Potter_and_the_Deathly_Hallows,759.0,,,"Fantasy, Young Adult, Fiction, Harry Potter, Magic"
The Odyssey,Homer,3.83,1196754,,9780143039952,https://m.media-amazon.com/images/S/compressed.photo.goodreads.com/books/1711957706i/1381.jpg,,https://www.goodreads.com/book/show/1381.The_Odyssey,541.0,,,"Classics, Fiction, Poetry, Mythology, Fantasy"
Frankenstein: The 1818 Text,Mary Wollstonecraft Shelley,3.91,1899902,,9780143131847,https://m.media-amazon.com/images/S/compressed.photo.goodreads.com/books/1631088473i/35031085.jpg,,https://www.goodreads.com/book/show/35031085-frankenstein,260.0,,,"Classics, Horror, Fiction, Science Fiction, Gothic"
"The Handmaid’s Tale (The Handmaid&apos;s Tale, #1)",Margaret Atwood,4.15,2434684,,9780385490818,https://m.media-amazon.com/images/S/compressed.photo.goodreads.com/books/1578028274i/38447.jpg,,https://www.goodreads.com/book/show/38447.The_Handmaid_s_Tale,311.0,,,"Fiction, Classics, Dystopia, Science Fiction, Feminism"
"A Wrinkle in Time (Time Quintet, #1)",Madeleine L&apos;Engle,3.97,1288069,,9781250153272,https://m.media-amazon.com/images/S/compressed.photo.goodreads.com/books/1507963312i/33574273.jpg,,https://www.goodreads.com/book/show/33574273-a-wrinkle-in-time,218.0,,,"Fantasy, Fiction, Classics, Young Adult, Science Fiction"
The Kite Runner,Khaled Hosseini,4.36,3502841,,9781594631931,https://m.media-amazon.com/images/S/compressed.photo.goodreads.com/books/1579036753i/77203.jpg,,https://www.goodreads.com/book/show/77203.The_Kite_Runner,371.0,,,"Fiction, Historical Fiction, Classics, Contemporary, Book Club"
"The Giver (The Giver, #1)",Lois Lowry,4.12,2815951,,9780385732550,https://m.media-amazon.com/images/S/compressed.photo.goodreads.com/books/1342493368i/3636.jpg,,https://www.goodreads.com/book/show/3636.The_Giver,208.0,,,"Young Adult, Fiction, Classics, Dystopia, Science Fiction"
"Harry Potter and the Prisoner of Azkaban (Harry Potter, #3)",J.K. Rowling,4.58,4858889,,9780439655484,https://m.media-amazon.com/images/S/compressed.photo.goodreads.com/books/1630547330i/5.jpg,,https://www.goodreads.com/book/show/5.Harry_Potter_and_the_Prisoner_of_Azkaban,547.0,,,"Fantasy, Fiction, Young Adult, Harry Potter, Magic"
"The Girl With the Dragon Tattoo (Millennium, #1)",Stieg Larsson,4.18,3454590,,9780670069019,https://m.media-amazon.com/images/S/compressed.photo.goodreads.com/books/1684638853i/2429135.jpg,,https://www.goodreads.com/book/show/2429135.The_Girl_With_the_Dragon_Tattoo,480.0,,,"Fiction, Mystery, Thriller, Crime, Mystery Thriller"
"Dune (Dune, #1)",Frank Herbert,4.29,1632856,,9780593099322,https://m.media-amazon.com/images/S/compressed.photo.goodreads.com/books/1555447414i/44767458.jpg,,https://www.goodreads.com/book/show/44767458-dune,658.0,,,"Science Fiction, Fiction, Fantasy, Classics, Audiobook"
Where the Wild Things Are,Maurice Sendak,4.26,1065786,,9780099408390,https://m.media-amazon.com/images/S/compressed.photo.goodreads.com/books/1384434560i/19543.jpg,,https://www.goodreads.com/book/show/19543.Where_the_Wild_Things_Are,38.0,,,"Childrens, Picture Books, Classics, Fiction, Fantasy"
Green Eggs and Ham,Dr. Seuss,4.32,848579,,9780394800165,https://m.media-amazon.com/images/S/compressed.photo.goodreads.com/books/1673212751i/23772.jpg,,https://www.goodreads.com/book/show/23772.Green_Eggs_and_Ham,64.0,,,"Childrens, Picture Books, Classics, Fiction, Poetry"
The Lovely Bones,Alice Sebold,3.86,2464611,,9780316166683,https://m.media-amazon.com/images/S/compressed.photo.goodreads.com/books/1457810586i/12232938.jpg,,https://www.goodreads.com/book/show/12232938-the-lovely-bones,372.0,,,"Fiction, Mystery, Young Adult, Contemporary, Fantasy"
"The Adventures of Huckleberry Finn (Adventures of Tom and Huck, #2)",Mark Twain,3.83,1338646,,9780142437179,https://m.media-amazon.com/images/S/compressed.photo.goodreads.com/books/1546096879i/2956.jpg,,https://www.goodreads.com/book/show/2956.The_Adventures_of_Huckleberry_Finn,327.0,,,"Classics, Fiction, Historical Fiction, Adventure, Literature"
Life of Pi,Yann Martel,3.94,1756422,,9780770430078,https://m.media-amazon.com/images/S/compressed.photo.goodreads.com/books/1631251689i/4214.jpg,,https://www.goodreads.com/book/show/4214.Life_of_Pi,460.0,,,"Fiction, Fantasy, Classics, Book Club, Adventure"
Lolita,Vladimir Nabokov,3.87,948308,,,https://m.media-amazon.com/images/S/compressed.photo.goodreads.com/books/1377756377i/7604.jpg,,https://www.goodreads.com/book/show/7604.Lolita,368.0,,,"Classics, Fiction, Literature, Russia, Novels"
A Tale of Two Cities,Charles Dickens,3.88,1014389,,9780141439600,https://m.media-amazon.com/images/S/compressed.photo.goodreads.com/books/1344922523i/1953.jpg,,https://www.goodreads.com/book/show/1953.A_Tale_of_Two_Cities,489.0,,,"Classics, Fiction, Historical Fiction, Literature, Historical"
Slaughterhouse-Five,Kurt Vonnegut Jr.,4.1,1486630,,,https://m.media-amazon.com/images/S/compressed.photo.goodreads.com/books/1440319389i/4981.jpg,,https://www.goodreads.com/book/show/4981.Slaughterhouse_Five,275.0,,,"Classics, Fiction, Science Fiction, Historical Fiction, War"
The Bell Jar,Sylvia Plath,4.05,1228729,,9780571268863,https://m.media-amazon.com/images/S/compressed.photo.goodreads.com/books/1554582218i/6514.jpg,,https://www.goodreads.com/book/show/6514.The_Bell_Jar,294.0,,,"Classics, Fiction, Feminism, Mental Health, Psychology"
Matilda,Roald Dahl,4.34,1113259,,9780435123987,https://m.media-amazon.com/images/S/compressed.photo.goodreads.com/books/1388793265i/39988.jpg,,https://www.goodreads.com/book/show/39988.Matilda,240.0,,,"Fiction, Childrens, Classics, Fantasy, Middle Grade"
Water for Elephants,Sara Gruen,4.11,1703382,,9781565125605,https://m.media-amazon.com/images/S/compressed.photo.goodreads.com/books/1667708346i/43641.jpg,,https://www.goodreads.com/book/show/43641.Water_for_Elephants,368.0,,,"Fiction, Historical Fiction, Romance, Book Club, Historical"
"Harry Potter and the Sorcerer&apos;s Stone (Harry Potter, #1)",J.K. Rowling,4.47,11448200,,,https://m.media-amazon.com/images/S/compressed.photo.goodreads.com/books/1598823299i/42844155.jpg,,https://www.goodreads.com/book/show/42844155-harry-potter-and-the-sorcerer-s-stone,333.0,,,"Fantasy, Fiction, Young Adult, Harry Potter, Magic"
The Stand,Stephen  King,4.35,837360,,,https://m.media-amazon.com/images/S/compressed.photo.goodreads.com/books/1213131305i/149267.jpg,,https://www.goodreads.com/book/show/149267.The_Stand,1152.0,,,"Horror, Fiction, Fantasy, Science Fiction, Post Apocalyptic"
Catch-22,Joseph Heller,3.99,888119,,9780684833392,https://m.media-amazon.com/images/S/compressed.photo.goodreads.com/books/1463157317i/168668.jpg,,https://www.goodreads.com/book/show/168668.Catch_22,453.0,,,"Classics, Fiction, Historical Fiction, War, Humor"
"The Adventures of Sherlock Holmes (Sherlock Holmes, #3)",Arthur Conan Doyle,4.3,326960,,,https://m.media-amazon.com/images/S/compressed.photo.goodreads.com/books/1164045516i/3590.jpg,,https://www.goodreads.com/book/show/3590.The_Adventures_of_Sherlock_Holmes,389.0,,,"Classics, Mystery, Fiction, Short Stories, Crime"
"The Pillars of the Earth (Kingsbridge, #1)",Ken Follett,4.35,832833,,9780451222138,https://m.media-amazon.com/images/S/compressed.photo.goodreads.com/books/1576956100i/5043.jpg,,https://www.goodreads.com/book/show/5043.The_Pillars_of_the_Earth,976.0,,,"Historical Fiction, Fiction, Historical, Fantasy, Classics"
Rebecca,Daphne du Maurier,4.25,724004,,9780316323703,https://m.media-amazon.com/images/S/compressed.photo.goodreads.com/books/1386605169i/17899948.jpg,,https://www.goodreads.com/book/show/17899948-rebecca,449.0,,,"Classics, Fiction, Mystery, Gothic, Romance"
"Watership Down (Watership Down, #1)",Richard  Adams,4.09,506354,,9780380395866,https://m.media-amazon.com/images/S/compressed.photo.goodreads.com/books/1405136931i/76620.jpg,,https://www.goodreads.com/book/show/76620.Watership_Down,478.0,,,"Classics, Fiction, Fantasy, Young Adult, Animals"
The Color Purple,Alice Walker,4.28,753851,,9780143135692,https://m.media-amazon.com/images/S/compressed.photo.goodreads.com/books/1703084419i/52892857.jpg,,https://www.goodreads.com/book/show/52892857-the-color-purple,287.0,,,"Classics, Fiction, Historical Fiction, Feminism, LGBT"
Great Expectations,Charles Dickens,3.8,875835,,9780192833594,https://m.media-amazon.com/images/S/compressed.photo.goodreads.com/books/1631687432i/2623.jpg,,https://www.goodreads.com/book/show/2623.Great_Expectations,544.0,,,"Classics, Fiction, Literature, Historical Fiction, School"
"Outlander (Outlander, #1)",Diana Gabaldon,4.26,1155979,,9780440242949,https://m.media-amazon.com/images/S/compressed.photo.goodreads.com/books/1659086907i/10964.jpg,,https://www.goodreads.com/book/show/10964.Outlander,850.0,,,"Historical Fiction, Romance, Fantasy, Fiction, Time Travel"
Anna Karenina,Leo Tolstoy,4.1,934427,,9780345803924,https://m.media-amazon.com/images/S/compressed.photo.goodreads.com/books/1546091617i/15823480.jpg,,https://www.goodreads.com/book/show/15823480-anna-karenina,964.0,,,"Classics, Fiction, Romance, Russia, Historical Fiction"
"The Fellowship of the Ring (The Lord of the Rings, #1)",J.R.R. Tolkien,4.41,3160221,,,https://m.media-amazon.com/images/S/compressed.photo.goodreads.com/books/1654215925i/61215351.jpg,,https://www.goodreads.com/book/show/61215351-the-fellowship-of-the-ring,432.0,,,"Fantasy, Classics, Fiction, Adventure, Audiobook"
A Clockwork Orange,Anthony Burgess,4,771532,,9780393341768,https://m.media-amazon.com/images/S/compressed.photo.goodreads.com/books/1549260060i/41817486.jpg,,https://www.goodreads.com/book/show/41817486-a-clockwork-orange,240.0,,,"Classics, Fiction, Science Fiction, Dystopia, Horror"
One Flew Over the Cuckoo’s Nest,Ken Kesey,4.2,781313,,,https://m.media-amazon.com/images/S/compressed.photo.goodreads.com/books/1516211014i/332613.jpg,,https://www.goodreads.com/book/show/332613.One_Flew_Over_the_Cuckoo_s_Nest,325.0,,,"Classics, Fiction, Psychology, Literature, Novels"
The Brothers Karamazov,Fyodor Dostoevsky,4.39,388357,,9780374528379,https://m.media-amazon.com/images/S/compressed.photo.goodreads.com/books/1427728126i/4934.jpg,,https://www.goodreads.com/book/show/4934.The_Brothers_Karamazov,796.0,,,"Classics, Fiction, Russia, Philosophy, Russian Literature"
My Sister&apos;s Keeper,Jodi Picoult,4.11,1277239,,9780743454537,https://m.media-amazon.com/images/S/compressed.photo.goodreads.com/books/1369504683i/10917.jpg,,https://www.goodreads.com/book/show/10917.My_Sister_s_Keeper,423.0,,,"Fiction, Contemporary, Book Club, Chick Lit, Young Adult"
To Kill a Mockingbird,Harper Lee,4.26,6905680,,,https://m.media-amazon.com/images/S/compressed.photo.goodreads.com/books/1554368352i/2654.jpg,,https://www.goodreads.com/book/show/2654.To_Kill_a_Mockingbird,323.0,,,"Classics, Fiction, Historical Fiction, School, Literature"
A Tree Grows in Brooklyn,Betty  Smith,4.3,513901,,9780061120077,https://m.media-amazon.com/images/S/compressed.photo.goodreads.com/books/1327883484i/14891.jpg,,https://www.goodreads.com/book/show/14891.A_Tree_Grows_in_Brooklyn,496.0,,,"Classics, Fiction, Historical Fiction, Book Club, Young Adult"
The Elephant Tree,R.D. Ronald,3.9,41120,,9781848764569,https://m.media-amazon.com/images/S/compressed.photo.goodreads.com/books/1327248026i/9293020.jpg,,https://www.goodreads.com/book/show/9293020-the-elephant-tree,252.0,,,"Thriller, Mystery, Crime, Fiction, Mystery Thriller"
